{
  "$schema": "https://json-schema.org/draft/2020-12/schema",
  "$id": "https://synapse.kkloudtarus.net/docs/schemas/events/fleet.agent.offline.v1.schema.json",
  "title": "fleet.agent.offline event (v1)",
  "description": "A fleet agent missed its heartbeat freshness window.",
  "type": "object",
  "properties": {
    "id": {
      "type": "string",
      "minLength": 1
    },
    "type": {
      "type": "string",
      "const": "fleet.agent.offline"
    },
    "source_kind": {
      "type": "string",
      "minLength": 1
    },
    "source_id": {
      "type": "string",
      "minLength": 1
    },
    "schema_version": {
      "type": "integer",
      "const": 1
    },
    "occurred_at": {
      "type": "string",
      "format": "date-time"
    },
    "data": {
      "type": "object",
      "properties": {
        "title": {
          "type": "string"
        },
        "summary": {
          "type": "string"
        },
        "agent_id": {
          "type": "string",
          "minLength": 1
        },
        "last_seen_at": {
          "type": "string",
          "format": "date-time"
        }
      },
      "required": [
        "title",
        "summary",
        "agent_id",
        "last_seen_at"
      ],
      "additionalProperties": true
    }
  },
  "required": [
    "id",
    "type",
    "source_kind",
    "source_id",
    "schema_version",
    "occurred_at",
    "data"
  ],
  "additionalProperties": true
}
